[I 2025-05-03 15:40:46,612] A new study created in RDB with name: gd_pops_v5_tuning
[I 2025-05-03 15:40:46,656] Trial 0 finished with value: 0.0 and parameters: {'learning_rate': 0.004493785920816759, 'optimizer_type': 'sgd', 'penalty_type': 'Exponential', 'penalty_lambda': 0.008414931839852416, 'N_grad_samples': 50}. Best is trial 0 with value: 0.0.
[I 2025-05-03 15:40:46,685] Trial 1 finished with value: 0.0 and parameters: {'learning_rate': 0.0002715079052479534, 'optimizer_type': 'adam', 'penalty_type': 'Reciprocal_L1', 'penalty_lambda': 0.008679241028282873, 'N_grad_samples': 10}. Best is trial 0 with value: 0.0.
[I 2025-05-03 15:40:46,712] Trial 2 finished with value: 0.0 and parameters: {'learning_rate': 0.0018794641329189063, 'optimizer_type': 'adam', 'penalty_type': 'None', 'penalty_lambda': 0.0007681493495697209, 'N_grad_samples': 10}. Best is trial 0 with value: 0.0.
[I 2025-05-03 15:40:46,757] Trial 3 finished with value: 0.0 and parameters: {'learning_rate': 0.008719873709216733, 'optimizer_type': 'sgd', 'penalty_type': 'Exponential', 'penalty_lambda': 0.00015359225802837994, 'N_grad_samples': 25}. Best is trial 0 with value: 0.0.
[I 2025-05-03 15:40:46,784] Trial 4 finished with value: 0.0 and parameters: {'learning_rate': 0.004989210904521616, 'optimizer_type': 'sgd', 'penalty_type': 'Quadratic_Barrier', 'penalty_lambda': 0.00026425159175678356, 'N_grad_samples': 75}. Best is trial 0 with value: 0.0.
[I 2025-05-03 15:40:46,817] Trial 5 finished with value: 0.0 and parameters: {'learning_rate': 0.000307691797353471, 'optimizer_type': 'sgd', 'penalty_type': 'Exponential', 'penalty_lambda': 0.0013063031638257164, 'N_grad_samples': 10}. Best is trial 0 with value: 0.0.
[I 2025-05-03 15:40:46,844] Trial 6 finished with value: 0.0 and parameters: {'learning_rate': 0.001971829299577316, 'optimizer_type': 'sgd', 'penalty_type': 'None', 'penalty_lambda': 1.4980647655196799e-05, 'N_grad_samples': 10}. Best is trial 0 with value: 0.0.
[I 2025-05-03 15:40:46,870] Trial 7 finished with value: 0.0 and parameters: {'learning_rate': 0.003185846646240045, 'optimizer_type': 'adam', 'penalty_type': 'None', 'penalty_lambda': 0.010813555143120749, 'N_grad_samples': 25}. Best is trial 0 with value: 0.0.
[I 2025-05-03 15:40:46,896] Trial 8 finished with value: 0.0 and parameters: {'learning_rate': 0.0006063902069475478, 'optimizer_type': 'adam', 'penalty_type': 'Reciprocal_L1', 'penalty_lambda': 6.350383150496121e-06, 'N_grad_samples': 10}. Best is trial 0 with value: 0.0.
[I 2025-05-03 15:40:46,924] Trial 9 finished with value: 0.0 and parameters: {'learning_rate': 0.002367316784018897, 'optimizer_type': 'sgd', 'penalty_type': 'Reciprocal_L1', 'penalty_lambda': 0.05035780478724111, 'N_grad_samples': 50}. Best is trial 0 with value: 0.0.
[I 2025-05-03 15:40:46,959] Trial 10 finished with value: 0.0 and parameters: {'learning_rate': 0.07187690465848828, 'optimizer_type': 'sgd', 'penalty_type': 'Exponential', 'penalty_lambda': 1.0230510500254183e-06, 'N_grad_samples': 50}. Best is trial 0 with value: 0.0.
[I 2025-05-03 15:40:46,999] Trial 11 finished with value: 0.0 and parameters: {'learning_rate': 0.0001143179940877277, 'optimizer_type': 'adam', 'penalty_type': 'Reciprocal_L1', 'penalty_lambda': 0.010278892859908639, 'N_grad_samples': 50}. Best is trial 0 with value: 0.0.
[I 2025-05-03 15:40:47,067] Trial 12 finished with value: 0.0 and parameters: {'learning_rate': 0.018966263917873396, 'optimizer_type': 'adam', 'penalty_type': 'Quadratic_Barrier', 'penalty_lambda': 0.09002320251480919, 'N_grad_samples': 75}. Best is trial 0 with value: 0.0.
[I 2025-05-03 15:40:47,101] Trial 13 finished with value: 0.0 and parameters: {'learning_rate': 0.0007350996832290019, 'optimizer_type': 'adam', 'penalty_type': 'Reciprocal_L1', 'penalty_lambda': 0.005184322909652457, 'N_grad_samples': 50}. Best is trial 0 with value: 0.0.
[I 2025-05-03 15:40:47,134] Trial 14 finished with value: 0.0 and parameters: {'learning_rate': 0.0198402093042811, 'optimizer_type': 'sgd', 'penalty_type': 'Exponential', 'penalty_lambda': 0.0025597815756053435, 'N_grad_samples': 10}. Best is trial 0 with value: 0.0.
[I 2025-05-03 15:40:47,193] Trial 15 finished with value: 0.0 and parameters: {'learning_rate': 0.00010901489779137885, 'optimizer_type': 'adam', 'penalty_type': 'Reciprocal_L1', 'penalty_lambda': 0.04361991053689351, 'N_grad_samples': 50}. Best is trial 0 with value: 0.0.
[I 2025-05-03 15:40:47,226] Trial 16 finished with value: 0.0 and parameters: {'learning_rate': 0.0008679999069021233, 'optimizer_type': 'adam', 'penalty_type': 'Exponential', 'penalty_lambda': 6.852921282388519e-05, 'N_grad_samples': 75}. Best is trial 0 with value: 0.0.
[I 2025-05-03 15:40:47,259] Trial 17 finished with value: 0.0 and parameters: {'learning_rate': 0.010023524279979852, 'optimizer_type': 'sgd', 'penalty_type': 'Quadratic_Barrier', 'penalty_lambda': 0.018565415253901926, 'N_grad_samples': 25}. Best is trial 0 with value: 0.0.
[I 2025-05-03 15:40:47,295] Trial 18 finished with value: 0.0 and parameters: {'learning_rate': 0.0003494270404018529, 'optimizer_type': 'sgd', 'penalty_type': 'Reciprocal_L1', 'penalty_lambda': 0.0007671729813365024, 'N_grad_samples': 10}. Best is trial 0 with value: 0.0.
[I 2025-05-03 15:40:47,334] Trial 19 finished with value: 0.0 and parameters: {'learning_rate': 0.0724299919770377, 'optimizer_type': 'adam', 'penalty_type': 'Exponential', 'penalty_lambda': 0.005306275030954157, 'N_grad_samples': 50}. Best is trial 0 with value: 0.0.
[I 2025-05-03 15:40:47,376] Trial 20 finished with value: 0.0 and parameters: {'learning_rate': 0.0002270752892592267, 'optimizer_type': 'adam', 'penalty_type': 'Exponential', 'penalty_lambda': 0.023817654802897888, 'N_grad_samples': 50}. Best is trial 0 with value: 0.0.
[I 2025-05-03 15:40:47,412] Trial 21 finished with value: 0.0 and parameters: {'learning_rate': 0.0014114141120062074, 'optimizer_type': 'adam', 'penalty_type': 'None', 'penalty_lambda': 0.0008101926268438321, 'N_grad_samples': 10}. Best is trial 0 with value: 0.0.
[I 2025-05-03 15:40:47,445] Trial 22 finished with value: 0.0 and parameters: {'learning_rate': 0.0048580865842251745, 'optimizer_type': 'adam', 'penalty_type': 'None', 'penalty_lambda': 0.0021776894889746928, 'N_grad_samples': 10}. Best is trial 0 with value: 0.0.
[I 2025-05-03 15:40:47,480] Trial 23 finished with value: 0.0 and parameters: {'learning_rate': 0.0011576680790586678, 'optimizer_type': 'adam', 'penalty_type': 'None', 'penalty_lambda': 0.0004440424867128349, 'N_grad_samples': 10}. Best is trial 0 with value: 0.0.
[I 2025-05-03 15:40:47,516] Trial 24 finished with value: 0.0 and parameters: {'learning_rate': 0.02570154373466741, 'optimizer_type': 'adam', 'penalty_type': 'None', 'penalty_lambda': 0.004418285677433084, 'N_grad_samples': 10}. Best is trial 0 with value: 0.0.
[I 2025-05-03 15:40:47,552] Trial 25 finished with value: 0.0 and parameters: {'learning_rate': 0.004253971347136512, 'optimizer_type': 'adam', 'penalty_type': 'None', 'penalty_lambda': 0.0001167452739694109, 'N_grad_samples': 10}. Best is trial 0 with value: 0.0.
[I 2025-05-03 15:40:47,587] Trial 26 finished with value: 0.0 and parameters: {'learning_rate': 0.009047081320503468, 'optimizer_type': 'sgd', 'penalty_type': 'Reciprocal_L1', 'penalty_lambda': 4.0812716340629794e-05, 'N_grad_samples': 75}. Best is trial 0 with value: 0.0.
[I 2025-05-03 15:40:47,623] Trial 27 finished with value: 0.0 and parameters: {'learning_rate': 0.0004267485525064242, 'optimizer_type': 'adam', 'penalty_type': 'Quadratic_Barrier', 'penalty_lambda': 0.0017871912999672507, 'N_grad_samples': 25}. Best is trial 0 with value: 0.0.
[I 2025-05-03 15:40:47,659] Trial 28 finished with value: 0.0 and parameters: {'learning_rate': 0.00020226042291992342, 'optimizer_type': 'sgd', 'penalty_type': 'Exponential', 'penalty_lambda': 0.012288074653408997, 'N_grad_samples': 10}. Best is trial 0 with value: 0.0.
[I 2025-05-03 15:40:47,696] Trial 29 finished with value: 0.0 and parameters: {'learning_rate': 0.0016543429080804835, 'optimizer_type': 'sgd', 'penalty_type': 'None', 'penalty_lambda': 0.0003111782231511106, 'N_grad_samples': 25}. Best is trial 0 with value: 0.0.
[I 2025-05-03 15:40:47,734] Trial 30 finished with value: 0.0 and parameters: {'learning_rate': 0.0068422987802992845, 'optimizer_type': 'adam', 'penalty_type': 'Reciprocal_L1', 'penalty_lambda': 0.004127377286583438, 'N_grad_samples': 50}. Best is trial 0 with value: 0.0.
[I 2025-05-03 15:40:47,772] Trial 31 finished with value: 0.0 and parameters: {'learning_rate': 0.011307905444126775, 'optimizer_type': 'sgd', 'penalty_type': 'Exponential', 'penalty_lambda': 0.00015390725425849835, 'N_grad_samples': 25}. Best is trial 0 with value: 0.0.
[I 2025-05-03 15:40:47,809] Trial 32 finished with value: 0.0 and parameters: {'learning_rate': 0.006524654094661758, 'optimizer_type': 'sgd', 'penalty_type': 'Exponential', 'penalty_lambda': 0.0005955196761002372, 'N_grad_samples': 25}. Best is trial 0 with value: 0.0.
[I 2025-05-03 15:40:47,847] Trial 33 finished with value: 0.0 and parameters: {'learning_rate': 0.0028613748832450156, 'optimizer_type': 'sgd', 'penalty_type': 'Exponential', 'penalty_lambda': 2.6127398324262414e-05, 'N_grad_samples': 25}. Best is trial 0 with value: 0.0.
[I 2025-05-03 15:40:47,930] Trial 34 finished with value: 0.0 and parameters: {'learning_rate': 0.04405479913666736, 'optimizer_type': 'sgd', 'penalty_type': 'Exponential', 'penalty_lambda': 0.0001380622382997408, 'N_grad_samples': 75}. Best is trial 0 with value: 0.0.
[I 2025-05-03 15:40:47,967] Trial 35 finished with value: 0.0 and parameters: {'learning_rate': 0.0034092085732505524, 'optimizer_type': 'sgd', 'penalty_type': 'Quadratic_Barrier', 'penalty_lambda': 0.0012279823617467186, 'N_grad_samples': 10}. Best is trial 0 with value: 0.0.
[I 2025-05-03 15:40:48,004] Trial 36 finished with value: 0.0 and parameters: {'learning_rate': 0.0021705384087634346, 'optimizer_type': 'sgd', 'penalty_type': 'Exponential', 'penalty_lambda': 0.008327144910041065, 'N_grad_samples': 25}. Best is trial 0 with value: 0.0.
[I 2025-05-03 15:40:48,043] Trial 37 finished with value: 0.0 and parameters: {'learning_rate': 0.0005188724804413435, 'optimizer_type': 'sgd', 'penalty_type': 'None', 'penalty_lambda': 7.698598016696352e-06, 'N_grad_samples': 10}. Best is trial 0 with value: 0.0.
[I 2025-05-03 15:40:48,087] Trial 38 finished with value: 0.0 and parameters: {'learning_rate': 0.014026838152437594, 'optimizer_type': 'adam', 'penalty_type': 'Reciprocal_L1', 'penalty_lambda': 0.0002398002889180069, 'N_grad_samples': 10}. Best is trial 0 with value: 0.0.
[I 2025-05-03 15:40:48,138] Trial 39 finished with value: 0.0 and parameters: {'learning_rate': 0.03406741498776963, 'optimizer_type': 'sgd', 'penalty_type': 'Exponential', 'penalty_lambda': 0.02674942656301228, 'N_grad_samples': 50}. Best is trial 0 with value: 0.0.
[I 2025-05-03 15:40:48,181] Trial 40 finished with value: 0.0 and parameters: {'learning_rate': 0.0010526660466627642, 'optimizer_type': 'adam', 'penalty_type': 'None', 'penalty_lambda': 1.2279291385341792e-06, 'N_grad_samples': 25}. Best is trial 0 with value: 0.0.
[I 2025-05-03 15:40:48,220] Trial 41 finished with value: 0.0 and parameters: {'learning_rate': 0.006203618733204204, 'optimizer_type': 'sgd', 'penalty_type': 'Quadratic_Barrier', 'penalty_lambda': 8.830185697807267e-05, 'N_grad_samples': 75}. Best is trial 0 with value: 0.0.
[I 2025-05-03 15:40:48,259] Trial 42 finished with value: 0.0 and parameters: {'learning_rate': 0.0027649650025669027, 'optimizer_type': 'sgd', 'penalty_type': 'Quadratic_Barrier', 'penalty_lambda': 0.0002918648814452974, 'N_grad_samples': 75}. Best is trial 0 with value: 0.0.
[I 2025-05-03 15:40:48,299] Trial 43 finished with value: 0.0 and parameters: {'learning_rate': 0.003914543771683936, 'optimizer_type': 'sgd', 'penalty_type': 'Quadratic_Barrier', 'penalty_lambda': 5.432242851124454e-05, 'N_grad_samples': 75}. Best is trial 0 with value: 0.0.
[I 2025-05-03 15:40:48,338] Trial 44 finished with value: 0.0 and parameters: {'learning_rate': 0.014648449898525446, 'optimizer_type': 'sgd', 'penalty_type': 'Reciprocal_L1', 'penalty_lambda': 0.05711213289304271, 'N_grad_samples': 75}. Best is trial 0 with value: 0.0.
[I 2025-05-03 15:40:48,377] Trial 45 finished with value: 0.0 and parameters: {'learning_rate': 0.0019826626887078894, 'optimizer_type': 'sgd', 'penalty_type': 'Exponential', 'penalty_lambda': 0.0011851607190294495, 'N_grad_samples': 50}. Best is trial 0 with value: 0.0.
[I 2025-05-03 15:40:48,416] Trial 46 finished with value: 0.0 and parameters: {'learning_rate': 0.0001502268151220384, 'optimizer_type': 'adam', 'penalty_type': 'Quadratic_Barrier', 'penalty_lambda': 0.000517334489679104, 'N_grad_samples': 10}. Best is trial 0 with value: 0.0.
[I 2025-05-03 15:40:48,454] Trial 47 finished with value: 0.0 and parameters: {'learning_rate': 0.00824892685166312, 'optimizer_type': 'sgd', 'penalty_type': 'Reciprocal_L1', 'penalty_lambda': 0.0028489002411513794, 'N_grad_samples': 50}. Best is trial 0 with value: 0.0.
[I 2025-05-03 15:40:48,493] Trial 48 finished with value: 0.0 and parameters: {'learning_rate': 0.00550431339814884, 'optimizer_type': 'adam', 'penalty_type': 'Quadratic_Barrier', 'penalty_lambda': 1.3219908661878115e-05, 'N_grad_samples': 75}. Best is trial 0 with value: 0.0.
[I 2025-05-03 15:40:48,530] Trial 49 finished with value: 0.0 and parameters: {'learning_rate': 0.0008511363205798152, 'optimizer_type': 'sgd', 'penalty_type': 'Exponential', 'penalty_lambda': 0.00020964390154599088, 'N_grad_samples': 50}. Best is trial 0 with value: 0.0.
